{
  "result_id": "tool-call-result:fixture",
  "call_id": "tool-call:fixture",
  "tool_id": "aidens:repo-read:1",
  "input_digest": "blake3:7d6441497d2a000b8143602a7817c90abe7db88e139f89c062a1c36cfe0ad9d6",
  "output": {
    "tool_id": "aidens:repo-read:1",
    "path": "README.md",
    "bytes": 7,
    "content": "content"
  },
  "output_digest": "blake3:4851cdcfda2c6353c4f8549eacf89c24b7a406a3b2092227e3f1100f92bfc843",
  "succeeded": true,
  "invocation_receipt_id": "tool-invocation:fixture",
  "reason_codes": [],
  "completed_at": "2026-04-26T00:00:00Z"
}
